{
  "schema_kind": "rdl_scene",
  "scene_name": "scene_031_transport_center",
  "environment_type": "indoor",
  "dimensions": {
    "width": 25.2,
    "height": 4.0,
    "depth": 22.4
  },
  "room_bounds": {
    "min_x": -12.6,
    "max_x": 12.6,
    "min_z": -11.2,
    "max_z": 11.2
  },
  "objects": [
    {
      "object_id": "object_001",
      "source_id": "object_001",
      "object_type": "wheel_display",
      "group": "collection_1",
      "position": {
        "x": -8.4,
        "y": 0.715,
        "z": -7.0
      },
      "rotation": {
        "x": 0.0,
        "y": 0.0,
        "z": 0.0
      },
      "dimensions": {
        "width": 0.8,
        "height": 1.43,
        "depth": 0.8
      },
      "specification": "Synthetic transport center object: wheel display. Display 1 explains a distinct example in collection 1. A freestanding educational display with a clearly visible label; no real person or institution.",
      "children_count": 0
    },
    {
      "object_id": "object_002",
      "source_id": "object_002",
      "object_type": "route_map",
      "group": "collection_2",
      "position": {
        "x": -5.6,
        "y": 0.515,
        "z": -7.0
      },
      "rotation": {
        "x": 0.0,
        "y": 0.0,
        "z": 0.0
      },
      "dimensions": {
        "width": 0.8,
        "height": 1.03,
        "depth": 0.8
      },
      "specification": "Synthetic transport center object: route map. Display 2 explains a distinct example in collection 2. A freestanding educational display with a clearly visible label; no real person or institution.",
      "children_count": 0
    },
    {
      "object_id": "object_003",
      "source_id": "object_003",
      "object_type": "rail_model",
      "group": "collection_3",
      "position": {
        "x": -2.8,
        "y": 0.59,
        "z": -7.0
      },
      "rotation": {
        "x": 0.0,
        "y": 0.0,
        "z": 0.0
      },
      "dimensions": {
        "width": 0.8,
        "height": 1.18,
        "depth": 0.8
      },
      "specification": "Synthetic transport center object: rail model. Display 3 explains a distinct example in collection 3. A freestanding educational display with a clearly visible label; no real person or institution.",
      "children_count": 0
    },
    {
      "object_id": "object_004",
      "source_id": "object_004",
      "object_type": "bicycle_display",
      "group": "collection_1",
      "position": {
        "x": 0.0,
        "y": 0.56,
        "z": -7.0
      },
      "rotation": {
        "x": 0.0,
        "y": 0.0,
        "z": 0.0
      },
      "dimensions": {
        "width": 0.8,
        "height": 1.12,
        "depth": 0.8
      },
      "specification": "Synthetic transport center object: bicycle display. Display 4 explains a distinct example in collection 1. A freestanding educational display with a clearly visible label; no real person or institution.",
      "children_count": 0
    },
    {
      "object_id": "object_005",
      "source_id": "object_005",
      "object_type": "bridge_model",
      "group": "collection_2",
      "position": {
        "x": 2.8,
        "y": 0.455,
        "z": -7.0
      },
      "rotation": {
        "x": 0.0,
        "y": 0.0,
        "z": 0.0
      },
      "dimensions": {
        "width": 0.8,
        "height": 0.91,
        "depth": 0.8
      },
      "specification": "Synthetic transport center object: bridge model. Display 5 explains a distinct example in collection 2. A freestanding educational display with a clearly visible label; no real person or institution.",
      "children_count": 0
    },
    {
      "object_id": "object_006",
      "source_id": "object_006",
      "object_type": "signal_station",
      "group": "collection_3",
      "position": {
        "x": 5.6,
        "y": 0.7,
        "z": -7.0
      },
      "rotation": {
        "x": 0.0,
        "y": 0.0,
        "z": 0.0
      },
      "dimensions": {
        "width": 0.8,
        "height": 1.4,
        "depth": 0.8
      },
      "specification": "Synthetic transport center object: signal station. Display 6 explains a distinct example in collection 3. A freestanding educational display with a clearly visible label; no real person or institution.",
      "children_count": 0
    },
    {
      "object_id": "object_007",
      "source_id": "object_007",
      "object_type": "wheel_display",
      "group": "collection_1",
      "position": {
        "x": 8.4,
        "y": 0.72,
        "z": -7.0
      },
      "rotation": {
        "x": 0.0,
        "y": 0.0,
        "z": 0.0
      },
      "dimensions": {
        "width": 0.8,
        "height": 1.44,
        "depth": 0.8
      },
      "specification": "Synthetic transport center object: wheel display. Display 7 explains a distinct example in collection 1. A freestanding educational display with a clearly visible label; no real person or institution.",
      "children_count": 0
    },
    {
      "object_id": "object_008",
      "source_id": "object_008",
      "object_type": "route_map",
      "group": "collection_2",
      "position": {
        "x": -8.4,
        "y": 0.41,
        "z": -4.2
      },
      "rotation": {
        "x": 0.0,
        "y": 0.0,
        "z": 0.0
      },
      "dimensions": {
        "width": 0.8,
        "height": 0.82,
        "depth": 0.8
      },
      "specification": "Synthetic transport center object: route map. Display 8 explains a distinct example in collection 2. A freestanding educational display with a clearly visible label; no real person or institution.",
      "children_count": 0
    },
    {
      "object_id": "object_009",
      "source_id": "object_009",
      "object_type": "rail_model",
      "group": "collection_3",
      "position": {
        "x": -5.6,
        "y": 0.475,
        "z": -4.2
      },
      "rotation": {
        "x": 0.0,
        "y": 0.0,
        "z": 0.0
      },
      "dimensions": {
        "width": 0.8,
        "height": 0.95,
        "depth": 0.8
      },
      "specification": "Synthetic transport center object: rail model. Display 9 explains a distinct example in collection 3. A freestanding educational display with a clearly visible label; no real person or institution.",
      "children_count": 0
    },
    {
      "object_id": "object_010",
      "source_id": "object_010",
      "object_type": "bicycle_display",
      "group": "collection_1",
      "position": {
        "x": -2.8,
        "y": 0.525,
        "z": -4.2
      },
      "rotation": {
        "x": 0.0,
        "y": 0.0,
        "z": 0.0
      },
      "dimensions": {
        "width": 0.8,
        "height": 1.05,
        "depth": 0.8
      },
      "specification": "Synthetic transport center object: bicycle display. Display 10 explains a distinct example in collection 1. A freestanding educational display with a clearly visible label; no real person or institution.",
      "children_count": 0
    },
    {
      "object_id": "object_011",
      "source_id": "object_011",
      "object_type": "bridge_model",
      "group": "collection_2",
      "position": {
        "x": 0.0,
        "y": 0.685,
        "z": -4.2
      },
      "rotation": {
        "x": 0.0,
        "y": 0.0,
        "z": 0.0
      },
      "dimensions": {
        "width": 0.8,
        "height": 1.37,
        "depth": 0.8
      },
      "specification": "Synthetic transport center object: bridge model. Display 11 explains a distinct example in collection 2. A freestanding educational display with a clearly visible label; no real person or institution.",
      "children_count": 0
    },
    {
      "object_id": "object_012",
      "source_id": "object_012",
      "object_type": "signal_station",
      "group": "collection_3",
      "position": {
        "x": 2.8,
        "y": 0.475,
        "z": -4.2
      },
      "rotation": {
        "x": 0.0,
        "y": 0.0,
        "z": 0.0
      },
      "dimensions": {
        "width": 0.8,
        "height": 0.95,
        "depth": 0.8
      },
      "specification": "Synthetic transport center object: signal station. Display 12 explains a distinct example in collection 3. A freestanding educational display with a clearly visible label; no real person or institution.",
      "children_count": 0
    },
    {
      "object_id": "object_013",
      "source_id": "object_013",
      "object_type": "wheel_display",
      "group": "collection_1",
      "position": {
        "x": 5.6,
        "y": 0.535,
        "z": -4.2
      },
      "rotation": {
        "x": 0.0,
        "y": 0.0,
        "z": 0.0
      },
      "dimensions": {
        "width": 0.8,
        "height": 1.07,
        "depth": 0.8
      },
      "specification": "Synthetic transport center object: wheel display. Display 13 explains a distinct example in collection 1. A freestanding educational display with a clearly visible label; no real person or institution.",
      "children_count": 0
    },
    {
      "object_id": "object_014",
      "source_id": "object_014",
      "object_type": "route_map",
      "group": "collection_2",
      "position": {
        "x": 8.4,
        "y": 0.695,
        "z": -4.2
      },
      "rotation": {
        "x": 0.0,
        "y": 0.0,
        "z": 0.0
      },
      "dimensions": {
        "width": 0.8,
        "height": 1.39,
        "depth": 0.8
      },
      "specification": "Synthetic transport center object: route map. Display 14 explains a distinct example in collection 2. A freestanding educational display with a clearly visible label; no real person or institution.",
      "children_count": 0
    },
    {
      "object_id": "object_015",
      "source_id": "object_015",
      "object_type": "rail_model",
      "group": "collection_3",
      "position": {
        "x": -8.4,
        "y": 0.475,
        "z": -1.4
      },
      "rotation": {
        "x": 0.0,
        "y": 0.0,
        "z": 0.0
      },
      "dimensions": {
        "width": 0.8,
        "height": 0.95,
        "depth": 0.8